{
  "version": 1,
  "evidenceClasses": ["preflight", "diagnostic", "acceptance", "planned"],
  "cadences": ["per-change", "weekly", "on-demand", "before-release", "manual"],
  "transportTrustReadiness": {
    "services": ["indexer", "node", "prover"],
    "environments": [
      {
        "id": "standalone",
        "policy": "development-loopback",
        "serviceIds": ["indexer", "node", "prover"],
        "prerequisites": ["owned-loopback-stack", "local-development-build"],
        "targetEvidence": [
          {"targetId": "android-emulator", "availability": "automated", "evidenceClass": "diagnostic"},
          {"targetId": "ios-simulator", "availability": "automated", "evidenceClass": "diagnostic"},
          {"targetId": "android-physical", "availability": "unsupported", "evidenceClass": "planned"},
          {"targetId": "ios-physical", "availability": "unsupported", "evidenceClass": "planned"}
        ]
      },
      {
        "id": "tailnet",
        "policy": "bundled-public-roots",
        "serviceIds": ["indexer", "node", "prover"],
        "prerequisites": ["magicdns-fqdn", "publicly-valid-host-certificate", "receipt-owned-serve-route"],
        "targetEvidence": [
          {"targetId": "android-emulator", "availability": "unsupported", "evidenceClass": "planned"},
          {"targetId": "ios-simulator", "availability": "manual", "evidenceClass": "diagnostic"},
          {"targetId": "android-physical", "availability": "manual", "evidenceClass": "acceptance"},
          {"targetId": "ios-physical", "availability": "unsupported", "evidenceClass": "planned"}
        ]
      },
      {
        "id": "preprod",
        "policy": "platform-trust",
        "serviceIds": ["indexer", "node", "prover"],
        "prerequisites": ["canonical-public-service-names", "operating-system-trust-store", "owner-authorized-account"],
        "targetEvidence": [
          {"targetId": "android-emulator", "availability": "unsupported", "evidenceClass": "planned"},
          {"targetId": "ios-simulator", "availability": "unsupported", "evidenceClass": "planned"},
          {"targetId": "android-physical", "availability": "manual", "evidenceClass": "acceptance"},
          {"targetId": "ios-physical", "availability": "unsupported", "evidenceClass": "planned"}
        ]
      }
    ],
    "verifierDependency": {
      "lines": [
        {"version": "0.5.3", "owner": "jsonrpsee-client-transport-0.24.11"},
        {"version": "0.7.0", "owner": "reqwest-0.13.4-and-platform-system"}
      ],
      "disposition": "temporary-upstream-split",
      "auditReference": "scripts/check-transport-trust.sh"
    }
  },
  "products": [
    {
      "id": "oxid-wallet",
      "name": "Oxid identity wallet",
      "targetIds": ["headless-development", "desktop-development", "android-physical", "android-emulator", "ios-simulator", "ios-physical"],
      "demoIds": ["secure-wallet-recovery", "standalone-wallet-asset-sync", "standalone-two-wallet-funding", "developer-proof-and-local-diagnostics", "portal-final-digital-passport-issuance", "oxid-wallet-essentials", "oxid-identity-wallet", "oxid-passport"]
    }
  ],
  "targets": [
    {"id": "headless-development", "platform": "headless", "support": "development-only", "note": "Controlled headless development preflight can prove protocol and protected-store boundaries but is not a rendered user-interface or device claim."},
    {"id": "desktop-development", "platform": "desktop", "support": "development-only", "note": "Fast UI and application preflight; it cannot prove native user presence."},
    {"id": "android-physical", "platform": "android", "support": "manual-acceptance", "note": "Supported exact-artifact build, deploy, and run target; physical Android is authoritative for native presence."},
    {"id": "android-emulator", "platform": "android", "support": "diagnostic-only", "note": "Disposable-emulator automation is diagnostic and never substitutes for physical acceptance."},
    {"id": "ios-simulator", "platform": "ios", "support": "diagnostic-only", "note": "Supported simulator build/deploy/run target; LocalAuthentication behavior is diagnostic rather than physical evidence."},
    {"id": "ios-physical", "platform": "ios", "support": "unsupported", "note": "Physical iOS signing, provisioning, and deployment are not implemented by this repository."}
  ],
  "dependencies": [
    {
      "id": "android-physical-device", "kind": "device", "mutable": true, "owner": "demo operator",
      "preparationCommandIds": ["android-device-status"], "healthCheckIds": ["android-device-connected"], "cleanupCommandIds": ["android-physical-cleanup"],
      "note": "Use one unlocked, authorized physical Android device. Never persist its identifier in public evidence."
    },
    {
      "id": "android-disposable-emulator", "kind": "simulator", "mutable": true, "owner": "native-custody diagnostic harness",
      "preparationCommandIds": [], "healthCheckIds": [], "cleanupCommandIds": ["android-emulator-cleanup"],
      "note": "The existing harness owns its disposable credential, app data, forwarded port, and cleanup trap."
    },
    {
      "id": "ios-disposable-simulator", "kind": "simulator", "mutable": true, "owner": "native-custody diagnostic harness",
      "preparationCommandIds": [], "healthCheckIds": [], "cleanupCommandIds": ["ios-simulator-cleanup"],
      "note": "The existing simulator harness owns the app lifecycle and its scoped cleanup."
    },
    {"id": "standalone-local-stack","kind": "service","mutable": true,"owner": "demo operator","preparationCommandIds": ["standalone-local-up"],"healthCheckIds": ["standalone-local-ready"],"cleanupCommandIds": ["standalone-stack-cleanup"],"note": "Repository-owned node, indexer, and proof-server containers bind only to loopback; the operator owns start and paired cleanup."},
    {"id": "standalone-tailnet-stack","kind": "network","mutable": true,"owner": "demo operator","preparationCommandIds": ["standalone-tailnet-up"],"healthCheckIds": ["standalone-tailnet-ready"],"cleanupCommandIds": ["standalone-stack-cleanup"],"note": "The same repository-owned stack is exposed only through Oxid-owned temporary Tailscale Serve routes; it is development routing, not a public Midnight deployment."},
    {"id": "portal-local-consumer-harness", "kind": "service", "mutable": true, "owner": "Portal owner-invoked harness", "preparationCommandIds": [], "healthCheckIds": [], "cleanupCommandIds": ["portal-local-cleanup-delegated"], "note": "The Portal headless, desktop, and virtual-mobile harnesses own only their receipt-scoped Portal consumer state and clean it before publishing closed evidence; they never own the standalone baseline."},
    {"id": "portal-tailnet-consumer-harness", "kind": "network", "mutable": true, "owner": "Portal owner-invoked harness", "preparationCommandIds": [], "healthCheckIds": [], "cleanupCommandIds": ["portal-tailnet-cleanup-delegated"], "note": "The physical Android harness owns only its receipt-scoped Portal resources and temporary Serve additions, restoring the exact prior Serve baseline; it never resets Tailnet or owns unrelated routes."},
    {"id": "desktop-proof-parameter-cache", "kind": "network", "mutable": true, "owner": "demo operator", "preparationCommandIds": [], "healthCheckIds": [], "cleanupCommandIds": ["desktop-proof-cache-review"], "note": "A first proof may fetch public parameters from srs.midnight.network into the app-private temporary benchmark cache. The operator owns network approval, disk budget, retention, and exact-cache cleanup."}
  ],
  "commands": [
    {"id": "desktop-build", "phase": "build", "command": "just desktop-build", "reference": "docs/factory/application-targets.md", "expectedOutcome": "Desktop development artifact builds successfully."},
    {"id": "desktop-run", "phase": "run", "command": "just desktop-run", "reference": "docs/factory/application-targets.md", "expectedOutcome": "Desktop development application starts for a non-production UI preflight."},
    {"id": "desktop-stop", "phase": "cleanup", "status": "manual", "reference": "docs/factory/demo-inventory.md", "expectedOutcome": "Operator stops the foreground desktop process without deleting unrelated state."},
    {"id": "desktop-proof-benchmark-build", "phase": "build", "command": "just desktop-proof-benchmark-build", "reference": "docs/migration/midnight-ledger-prototype.md", "expectedOutcome": "The native desktop development artifact is built with the explicit proof-benchmark feature and without release-profile claims."},
    {"id": "desktop-proof-benchmark-run", "phase": "run", "command": "just desktop-proof-benchmark-run", "reference": "docs/migration/midnight-ledger-prototype.md", "expectedOutcome": "The desktop developer profile opens with the single-worker proof controls; no proof starts until the operator selects Run."},
    {"id": "desktop-proof-cache-review", "phase": "cleanup", "status": "manual", "reference": "docs/migration/midnight-ledger-prototype.md", "expectedOutcome": "The operator either retains the public proving-parameter cache for reuse or explicitly removes only the app-private benchmark cache after the foreground app stops."},
    {"id": "headless-diagnostics-run", "phase": "run", "command": "just headless", "reference": "apps/oxid-headless/tests/capability_contracts/system.rs", "expectedOutcome": "The headless process accepts bounded diagnostics snapshot and confirmed-clear requests over its versioned NDJSON interface."},
    {"id": "headless-stop", "phase": "cleanup", "status": "manual", "reference": "docs/factory/demo-inventory.md", "expectedOutcome": "The operator stops the foreground headless process; its process-local diagnostic ring disappears without deleting unrelated state."},